sth,title,posted,d_type,timeplace,id
Zagovor magisterija,"Matija Kuclar, Signali nove fizike v semileptonskih razpadih mezona B v stanja čarobnih mezonov s pozitivno parnostjo",6. 9. 2016,Zagovor magisterija na Oddelku za fiziko,"v sredo, 14. september 2016, ob 10.00 uri v Kuščerjevem seminarju na Jadranski 19.",30350
Zagovor magisterija,"Tadej Mežnaršič, Lasersko hlajenje cezijevih atomov",5. 9. 2016,Zagovor magisterija na Oddelku za fiziko,"v četrtek 8. september 2016, ob 13.00 uri v Kuščerjevem seminarju na Jadranski 19.",30573
Zagovor magisterija,"Jan Ravnik, Opazovanje faznega prehoda v skrito kvantno stanje na femtosekundni časovni skali",5. 9. 2016,Zagovor magisterija na Oddelku za fiziko,"v sredo 7. september 2016, ob 11.00 uri v Kuščerjevem seminarju na Jadranski 19.",30539
Zagovor magistrskega dela,"Tomaž Skobe, Analiza parne eksplozije v poplavljeni reaktorski votlini",1. 9. 2016,Zagovor magisterija na Oddelku za fiziko,"v petek, 9. september 2016, ob 10. uri v Kuščerjevem seminarju na Jadranski 19 (4/414)",30574
Zagovor magisterija,"Nina Verdel, Silicijeva fotopomnoževalka kot senzor svetlobe Čerenkova pri pozitronski tomografiji",31. 8. 2016,Zagovor magisterija na Oddelku za fiziko,"v petek 2. september 2016, ob 12.00 uri v Kuščerjevem seminarju na Jadranski 19.",30462
Zagovor magisterija,"Tanja Kaiba, Odziv fisijskih in ionizacijskih celic na reaktorju TRIGA na IJS",30. 8. 2016,Zagovor magisterija na Oddelku za fiziko,"v petek 2. september 2016, ob 10.00 uri v Kuščerjevem seminarju na Jadranski 19.",28709
Zagovor magisterija,"Marion Antonia Van Midden, Rekonstrukcija spektralne funkcije Shibovega stanja iz diferencialne prevodnosti",30. 8. 2016,Zagovor magisterija na Oddelku za fiziko,"v četrtek 1. september 2016, ob 10.00 uri v Kuščerjevem seminarju na Jadranski 19.",30455
Zagovor magisterija,"Peter Šušnjar, Izvor ekstremne UV svetlobe na osnovi generacije višjih harmoničnih frekvenc v žlahtnih plinih",26. 8. 2016,Zagovor magisterija na Oddelku za fiziko,"v ponedeljek 5. september 2016, ob 10.00 uri v Kuščerjevem seminarju na Jadranski 19.",30359
Zagovor magisterija,"Janez Kokalj, Modeliranje poplavljanja plasti razbitkov v eksperimentalni napravi PEARL",25. 8. 2016,Zagovor magisterija na Oddelku za fiziko,"v torek 30. avgust 2016, ob 10.00 uri v Kuščerjevem seminarju na Jadranski 19.",30349
Zagovor magisterija,"Mateja Hrast, Izračun atomskih fotoionizacijskih presekov z metodo zunanjega kompleksnega raztega",25. 8. 2016,Zagovor magisterija na Oddelku za fiziko,"v ponedeljek 29. avgust 2016, ob 12.00 v predavalnici F-6 na Jadranski 19.",29910
Zagovor magisterija,"Črt Lozej, Časovno odvisni transport naboja in toplote skozi kvantno piko",24. 8. 2016,Zagovor magisterija na Oddelku za fiziko,"v ponedeljek 29. avgust 2016, ob 14.00 uri v Kuščerjevem seminarju na Jadranski 19.",30382
Zagovor magisterija,"Jošt Stergar, Optotermična manipulacija posameznih submikronskih delcev",23. 8. 2016,Zagovor magisterija na Oddelku za fiziko,"v sredo, 7. septembra 2016, ob 9.00 uri v Kuščerjevem seminarju na Jadranski 19.",29894
Zagovor magisterija,"Lara Ulčakar, Stabilnost magičnih razmerij prevodnosti majhnih grafenskih struktur",23. 8. 2016,Zagovor magisterija na Oddelku za fiziko,"v ponedeljek , 12. septembra 2016, ob 12.30 uri v Kuščerjevem seminarju na Jadranski 19.",29726
Zagovor magisterija,"Jan Fišer, Formiranje in prenos kovinskih nanokapljic na substrat s femtosekundnimi laserskimi sunki",12. 7. 2016,Zagovor magisterija na Oddelku za fiziko,"v petek , 15. julija 2016, ob 9.00 uri v Kuščerjevem seminarju na Jadranski 19. ",29893
Zagovor magisterija,"Tilen Potisk, Makroskopska dinamika feromagnetnih nematikov",5. 7. 2016,Zagovor magisterija na Oddelku za fiziko,"v petek , 8. julija 2016, ob 9.uri v Kuščerjevem seminarju na Jadranski 19.",30510
Zagovor magisterija,"Joško Knez, Zasnova avtomatskega meteorološkega merilnega sistema glede na zahteve uporabnikov meteoroloških podatkov z uporabo metode razvoja funkcij kakovosti",24. 6. 2016,Zagovor magisterija na Oddelku za fiziko,"v četrtek, 30. junija 2016, ob 10. uri v predavalnici F-2 (I. nadstr.) na Jadranski 19.",30411
Zagovor magisterija,"Klemen Pečnik, Uporaba NMR spektroskopije in metod strojnega učenja za natančnejše iskanje biomarkerjev tumorskih celic",23. 6. 2016,Zagovor magisterija na Oddelku za fiziko,"v četrtek , 30. junija 2016, ob 13.uri v Kuščerjevem seminarju na Jadranski 19.",30432
Zagovor magisterija,"Klemen Kelih, Analiza aktivnosti študentov pri izvajanju testnih projektov",23. 6. 2016,Zagovor magisterija na Oddelku za fiziko,"v ponedeljek, 27. junija 2016, ob 12.uri v F7 na Jadranski 19.",30415
Zagovor magisterija,"Marko Rožič, Video posnetek kot didaktični pripomoček pri pouku fizike",20. 5. 2016,Zagovor magisterija na Oddelku za fiziko,"v sredo, 1. junija 2016, ob 11.uri v Kuščerjevem seminarju (414/4) na Jadranski 19.",29319
Zagovor magisterija,"Vanja Sandrin, Uporaba 18 F-FDG PET/CT za ugotavljanje odziva na zdravljenje",3. 5. 2016,Zagovor magisterija na Oddelku za fiziko,"v četrtek, 5. 5. 2016 ob 9.15 uri v Kuščerjevem seminarju (414/4) na Jadranski 19.",28806
Zagovor magisterija,"Boštjan Kokot, Identifikacija kontakta med nanodelci in lipidnim dvoslojem",19. 4. 2016,Zagovor magisterija na Oddelku za fiziko,"v petek, 22. aprila 2016 ob 12.15 uri v Kuščerjevem seminarju na Jadranski 19.",34427
Zagovor magisterija,"Hana Majaron, Anizotropna difuzija kroglic v feromagnetnem tekočem kristalu",19. 4. 2016,Zagovor magisterija na Oddelku za fiziko,"v petek, 22. aprila 2016 ob 10.15 uri v Kuščerjevem seminarju na Jadranski 19.",34153
Zagovor magisterija,"Nina Lokar, Optimizacija kontrasta pri flourescenčni konfokalni mikroskopiji človeških lečnih epitelnih celic",28. 2. 2016,Zagovor magisterija na Oddelku za fiziko,"v torek, 8. 3. 2016 ob 13.30 uri v Kuščerjevem seminarju na Jadranski 19.",30235
Zagovor magisterija,"Tadej Dobravec, Razvoj metode celičnih avtomatov za probleme z evtektičnimi faznimi prehodi",25. 2. 2016,Zagovor magisterija na Oddelku za fiziko,"v sredo, 2. 3. 2016 ob 11.15 uri v Kuščerjevem seminarju na Jadranski 19.",30217
Zagovor magisterija,"Katja Kozjek, Objektivna opredelitev podnebnih regij Slovenije",2. 2. 2016,Zagovor magisterija na Oddelku za fiziko,"v petek, 5. februarja 2016 ob 10.15 uri v predavalnici F-2 na Jadranski 19.",34428
Zagovor magisterija,"Patricia Cotič, Sočasni EEG in fMRI pri 7 T za raziskave človeške spontane možganske aktivnosti",18. 12. 2015,Zagovor magisterija na Oddelku za fiziko,"v sredo, 23. decembra 2015 ob 10.15 uri v Kuščerjevem seminarju na Jadranski 19.",34270
Zagovor magisterija,"Larisa Hosnar, Kotno občutljiva kamera gama z rotacijsko zaslonko",15. 10. 2015,Zagovor magisterija na Oddelku za fiziko,"v četrtek, 22. septembra 2015 ob 9.30 uri v Kuščerjevem seminarju na Jadranski 19.",32677
Zagovor magisterija,"Lino Šalamon, Diagnostika magnetizirane plazme z ionsko občutljivo sondo",22. 9. 2015,Zagovor magisterija na Oddelku za fiziko,"v ponedeljek, 28. septembra 2015 ob 9.00 uri v Kuščerjevem seminarju na Jadranski 19.",34455
Zagovor magisterija,"Gašper Gregorič, Študij trikotnega Heisenbergovega antiferomagneta KCrO2 z elektronsko paramagnetno resonanco",22. 9. 2015,Zagovor magisterija na Oddelku za fiziko,"v petek, 25. septembra 2015 ob 10.30 uri v Kuščerjevem seminarju na Jadranski 19.",29318
Zagovor magisterija,"Klemen Ambrožič, Analiza možnosti za obsevanje z žarki γ na reaktorju TRIGA mark II IJS",22. 9. 2015,Zagovor magisterija na Oddelku za fiziko,"v petek, 25. septembra 2015 ob 9.00 uri v Kuščerjevem seminarju na Jadranski 19.",30189
Zagovor magisterija,"Ivan Kukuljan, Dinamične lastnosti neravnovesnega 2D kvantnega Isingovega modela",17. 9. 2015,Zagovor magisterija na Oddelku za fiziko,"v ponedeljek, 21. septembra 2015 ob 11. uri v Kuščerjevem seminarju na Jadranski 19.",30173
Zagovor magisterija,"Anja Bregar, Negativni lom na ravni površini optičnega metamateriala",10. 9. 2015,Zagovor magisterija na Oddelku za fiziko,"v ponedeljek, 14. septembra 2015 ob 10.30 uri v Kuščerjevem seminarju na Jadranski 19.",30131
Zagovor magisterija,"Luka Pirker, Mikročrpalka na principu termoviskoznega črpanja",9. 9. 2015,Zagovor magisterija na Oddelku za fiziko,"v torek, 15. septembra 2015 ob 9. uri v Kuščerjevem seminarju na Jadranski 19.",34452
Zagovor magisterija,"Luka Černe, Tomografija ozemlja Slovenije iz časov prihodov longitudinalnih potresnih valov",9. 9. 2015,Zagovor magisterija na Oddelku za fiziko,"v ponedeljek, 14. septembra 2015 ob 9. uri v Kuščerjevem seminarju na Jadranski 19.",34451
Zagovor magisterija,"Eva Mencin, Raziskave globinske strukture Iškega vršaja na Ljubljanskem barju z uporabo visokoločljive refleksijske seizmične metode",9. 9. 2015,Zagovor magisterija na Oddelku za fiziko,"v petek, 11. septembra 2015 ob 10. uri v predavalnici P-02, Privoz 11, UL NTF.",34431
Zagovor magisterija,"Ana Trobec, Raziskave zgradbe sedimentnega morskega dna v Strunjanskem zalivu s podpovršinskim sonarjem",9. 9. 2015,Zagovor magisterija na Oddelku za fiziko,"v sredo, 9. septembra 2015 ob 11.30 uri v predavalnici P-02, Privoz 11, UL NTF.",34450
Zagovor magisterija,"Tim Verbovšek, Preučevanje izolativne CuN monoplasti z STM mikroskopijo",8. 9. 2015,Zagovor magisterija na Oddelku za fiziko,"v četrtek, 10. septembra 2015 ob 15. uri v Kuščerjevem seminarju na Jadranski 19.",28498
Zagovor magisterija,"Tjaša Parkelj, STM mikroskopija tankih plasti superprevodnika na kovini",8. 9. 2015,Zagovor magisterija na Oddelku za fiziko,"v petek, 11. septembra 2015 ob 15. uri v Kuščerjevem seminarju na Jadranski 19.",34088
Zagovor magisterija,"Ana Marin, Določanje debeline enomolekulskih plasti maščobnih kislin na vodni gladini in na trdnih substratih",8. 9. 2015,Zagovor magisterija na Oddelku za fiziko,"v petek, 11. septembra 2015 ob 10.30 uri v Kuščerjevem seminarju na Jadranski 19.",32685
Zagovor magisterija,"Žiga Barba, Spektrometer za fotone z energijskim oknom v smeri vpadnega žarka",8. 9. 2015,Zagovor magisterija na Oddelku za fiziko,"v petek, 11. septembra 2015 ob 9. uri v Kuščerjevem seminarju na Jadranski 19.",30110
Zagovor magisterija,"Mitja Predikaka, Karakterizacija modulov za detektor obročev Čerenkova pri spektrometru Belle II",8. 9. 2015,Zagovor magisterija na Oddelku za fiziko,"v petek, 11. septembra 2015 ob 13.30 uri v Kuščerjevem seminarju na Jadranski 19.",30109
Zagovor magisterija,"Lenart Zadnik, Polciklične upodobitve kvantne grupe in kvazilokalne ohranjene količine",4. 9. 2015,Zagovor magisterija na Oddelku za fiziko,"v torek, 8. septembra 2015 ob 12. uri v Kuščerjevem seminarju na Jadranski 19.",32678
Zagovor magisterija,"Urša Skerbiš, Testiranje detektorja TOP s kozmicnimi mioni",3. 9. 2015,Zagovor magisterija na Oddelku za fiziko,"v četrtek, 10. septembra 2015 ob 9. uri v Kuščerjevem seminarju na Jadranski 19.",32674
Zagovor magisterija,"Matic Kunšek, Eksperimentalno opazovanje prehoda iz mehurčkastega v čepasti tok v dvofaznem toku plin-kapljevina",3. 9. 2015,Zagovor magisterija na Oddelku za fiziko,"v petek, 11. septembra 2015 ob 12. uri v Kuščerjevem seminarju na Jadranski 19.",32518
Zagovor magisterija,"Matjaž Ličen, Koloidni kristali z dodatkom magnetnih nanodelcev",2. 9. 2015,Zagovor magisterija na Oddelku za fiziko,"v sredo, 9. septembra 2015 ob 13. uri v Kuščerjevem seminarju na Jadranski 19.",32237
Zagovor magisterija,"Bor Kos, Izračun doznega polja nevtronov v okolici reaktorja tlačnovodne jedrske elektrarne",2. 9. 2015,Zagovor magisterija na Oddelku za fiziko,"v sredo, 9. septembra 2015 ob 11. uri v Kuščerjevem seminarju na Jadranski 19.",32638
Zagovor magisterija,"Maruša Turk, Odvisnost privzema radioizotopa v ščitnici od geometrijskih in kliničnih parametrov ter primerjava merilnih sistemov",27. 8. 2015,Zagovor magisterija na Oddelku za fiziko,"v ponedeljek, 31. avgusta 2015 ob 10. uri v Kuščerjevem seminarju na Jadranski 19. ",34151
Zagovor magisterija,"Gabrijela Ikovic, Študij ionskega energijskega analizatorja z delčno simulacijo",24. 8. 2015,Zagovor magisterija na Oddelku za fiziko,"v četrtek, 27. avgusta 2015 ob 10. uri v Kuščerjevem seminarju na Jadranski 19.",31585
Zagovor magisterija,"Rok Grah, Kvantna periodično brcana Isingova veriga",24. 8. 2015,Zagovor magisterija na Oddelku za fiziko,"v četrtek, 27. avgusta 2015 ob 12. uri v Kuščerjevem seminarju na Jadranski 19.",34416
Zagovor magisterija,"Tomaž Suhovršnik, Vpliv strukture sunka laserja Er:YAG in vodnega spreja na ablacijo sklenine",3. 7. 2015,Zagovor magisterija na Oddelku za fiziko,"v petek, 10. julija 2015 ob 11.30 uri v Kuščerjevem seminarju na Jadranski 19.",29592
Zagovor magisterija,"Jan Šömen, Magnetnoresonančno slikanje s prenosom magnetizacije",2. 7. 2015,Zagovor magisterija na Oddelku za fiziko,"v sredo, 8. julija 2015 ob 11.30 uri v Kuščerjevem seminarju na Jadranski 19.",32618
Zagovor magisterija,"Aljoša Polšak, Študija razpadov B0 -&gt; D(*)- π+ π0 π0 z detektorjema Belle in Belle II",4. 6. 2015,Zagovor magisterija na Oddelku za fiziko,"v torek, 9. junija 2015 ob 9. uri v predavalnici F-6 na Jadranski 19.",31653
Zagovor magisterija,"Jan Bohinec, Degeneracije pri določanju orbitalnih in gravitacijskih parametrov relativističnega navigacijskega sistema",12. 2. 2015,Zagovor magisterija na Oddelku za fiziko,"v sredo, 18. februarja 2015 ob 9. uri v Kuščerjevem seminarju na Jadranski 19.",34276
Zagovor magisterija,"Luka Čurović, Konformacije DNA skozi ray tracing",13. 1. 2015,Zagovor magisterija na Oddelku za fiziko,"v ponedeljek, 19. januarja 2015 ob 8.30 uri v predavalnici F-7 na Jadranski 19.",29478
Zagovor magisterija,"Matic Pirc, Analiza nevtronskega šuma za diagnosticiranje vibracij gorivnih elementov v NEK",16. 12. 2014,Zagovor magisterija na Oddelku za fiziko,"v petek, 19. decembra 2014 ob 13. uri v Kuščerjevem seminarju na Jadranski 19.",34269
Zagovor magisterija,"Mitja Kelemen, Vpliv implantacije visokoenergijskih ionov na magnetne lastnosti ogljika",16. 12. 2014,Zagovor magisterija na Oddelku za fiziko,"v petek, 19. decembra 2014 ob 11. uri v Kuščerjevem seminarju na Jadranski 19.",29425
Zagovor magisterija,"Jože Zobec, Mase lahkih fermionov v teoriji poenotenja SO(10) z dodatno težko generacijo",24. 10. 2014,Zagovor magisterija na Oddelku za fiziko,"v torek, 28.10.2014 ob 13.15 uri v Kuščerjevem seminarju na Jadranski 19",29297
Zagovor magisterija,"Angela Kochoska, The OC-D model of binary stars",26. 9. 2014,Zagovor magisterija na Oddelku za fiziko,"v torek, 30. septembra 2014 ob 10. uri v Kuščerjevem seminarju na Jadranski 19.",33950
Zagovor magisterija,"Petra Rogan, Dozimetrična evalvacija MOSFET dozimetrov in priprava sistema za klinično in-vivo dozimetrijo na linearnem pospeševalniku",16. 9. 2014,Zagovor magisterija na Oddelku za fiziko,"v četrtek, 18. septembra 2014 ob 11. uri v Kuščerjevem seminarju na Jadranski 19.",33976
Zagovor magisterija,"Janez Lužnik, Magnetizem hematitnih nanodelcev v obliki meduz",11. 9. 2014,Zagovor magisterija na Oddelku za fiziko,"v petek, 12. septembra 2014 ob 10. uri v predavalnici F-7 na Jadranski 19.",34235
Zagovor magisterija,"Tilen Brecelj, Uporaba spektroskopije v bližnji infrardeči svetlobi za določanje lastnosti zmesi granulatov",5. 9. 2014,Zagovor magisterija na Oddelku za fiziko,"v sredo, 10. septembra 2014 ob 10. uri v Kuščerjevem seminarju na Jadranski 19.",34234
Zagovor magisterija,"Miha Muškinja, Pomnoževanje nosilcev naboja v diamantnih detektorjih",5. 9. 2014,Zagovor magisterija na Oddelku za fiziko,"v ponedeljek, 8. septembra 2014 ob 10. uri v Kuščerjevem seminarju na Jadranski 19.",34228
Zagovor magisterija,"Boštjan Jenčič, Transportni pojavi v neurejenih Heisenbergovih spinskih verigah",3. 9. 2014,Zagovor magisterija na Oddelku za fiziko,"v petek, 5. septembra 2014 ob 13. uri v Kuščerjevem seminarju na Jadranski 19.",29122
Zagovor magisterija,"Matic Lubej, Študija meritve kršitve simetrije CP v razpadih D0 -&gt; π0π0",1. 9. 2014,Zagovor magisterija na Oddelku za fiziko,"v petek, 5. septembra 2014 ob 10.30 uri v Kuščerjevem seminarju na Jadranski 19.",34227
Zagovor magisterija,"Žiga Štancar, Računska analiza meritev profila moči v reaktorju TRIGA",1. 9. 2014,Zagovor magisterija na Oddelku za fiziko,"v petek, 5. septembra 2014 ob 9. uri v Kuščerjevem seminarju na Jadranski 19.",34209
Zagovor magisterija,"Alen Horvat, Magnetne lastnosti Sr2TcO4",1. 9. 2014,Zagovor magisterija na Oddelku za fiziko,"v četrtek, 4. septembra 2014 ob 10.30 uri v predavalnici F-7 na Jadranski 19.",31524
Zagovor magisterija,"Katja Vozel, Študija fotovzbujenih stanj v novih materialih za sončne celice s pulzno elektronsko paramagnetno resonanco",1. 9. 2014,Zagovor magisterija na Oddelku za fiziko,"v četrtek, 4. septembra 2014 ob 9. uri v predavalnici F-7 na Jadranski 19.",34208
Zagovor magisterija,"Manca Mrvar, Simulacije meritev E-TCT z visoko obsevanimi silicijevimi detektorji",26. 8. 2014,Zagovor magisterija na Oddelku za fiziko,"v četrtek, 28. avgusta 2014 ob 10. uri v Kuščerjevem seminarju na Jadranski 19.",29076
Zagovor magisterija,"Bor Kavčič, Limitne oblike ograjenih lipidnih vesiklov",14. 7. 2014,Zagovor magisterija na Oddelku za fiziko,"v četrtek, 17. julija 2014 ob 11.30 uri v Kuščerjevem seminarju na Jadranski 19.",31581
Zagovor magisterija,"Žiga Zaplotnik, Uporaba analize neodvisnih komponent v fizikalnih aplikacijah",11. 7. 2014,Zagovor magisterija na Oddelku za fiziko,"v četrtek, 17. julija 2014 ob 10. uri v Kuščerjevem seminarju na Jadranski 19.",31567
Zagovor magisterija,"Žiga Kos, Nematske celice s površinskimi vzorci sidranja",8. 7. 2014,Zagovor magisterija na Oddelku za fiziko,"v četrtek, 10. julija 2014 ob 11.30 uri v Kuščerjevem seminarju na Jadranski 19.",31535
Zagovor magisterija,"Jure Aplinc, Nematska mikrofluidika v kompleksnih mikro-kanalih",7. 7. 2014,Zagovor magisterija na Oddelku za fiziko,"v četrtek, 10. julija 2014 ob 9. uri v Kuščerjevem seminarju na Jadranski 19.",31534
Zagovor magisterija,"Marko Medenjak, Balistični transport v neintegrabilnih spinskih verigah",1. 7. 2014,Zagovor magisterija na Oddelku za fiziko,"v petek, 4. julija 2014 ob 15. uri v Kuščerjevem seminarju na Jadranski 19.",31523
Zagovor magisterija,"Veronika Hladnik, Objektna analiza padavin iz satelitskih meritev, reanaliz ERA-Interim ter modela WRF na območju Evrope in severnega Atlantika",20. 5. 2014,Zagovor magisterija na Oddelku za fiziko,"v petek, 23. maja 2014 ob 10. uri v predavalnici F-6 na Jadranski 19.",34430
Zagovor magisterija,"Daniel Grošelj, Tekmovanje med vrstami v dvodimenzionalnem turbulentnem toku",8. 4. 2014,Zagovor magisterija na Oddelku za fiziko,"v ponedeljek, 14. aprila 2014 ob 13.15 uri v Kuščerjevem seminarju na Jadranski 19.",34075
Zagovor magisterija,"Damijan Valentinuzzi, Modeliranje odziva tumorjev na zdravljenje s protiožiljnimi tarčnimi zdravili",15. 11. 2013,Zagovor magisterija na Oddelku za fiziko,"v sredo, 20. novembra 2013 ob 11.15 uri v Kuščerjevem seminarju na Jadranski 19.",34051
Zagovor magisterija,"Jaka Mur, Dvobarvna laserska fotolitografija",17. 9. 2013,Zagovor magisterija na Oddelku za fiziko,"v sredo, 18. septembra 2013 ob 10. uri v Kuščerjevem seminarju na Jadranski 19.",34445
Zagovor magisterija,"Tara Nanut, Študij vpliva ozadja na meritev razpadov D+-&gt;pi+l+l-",11. 9. 2013,Zagovor magisterija na Oddelku za fiziko,"v petek, 13. septembra 2013 ob 13. uri v Kuščerjevem seminarju na Jadranski 19.",33819
Zagovor magisterija,"Tadeja Forjanič, Rekonstrukcija tomografskih slik na osnovi sunkovne fototermalne radiometrije",10. 9. 2013,Zagovor magisterija na Oddelku za fiziko,"v četrtek, 12. septembra 2013 ob 8. uri v Kuščerjevem seminarju na Jadranski 19.",33780
Zagovor magisterija,"Peter Naglič, Določanje strukture človeške kože z difuzno refleksijsko spektroskopijo",9. 9. 2013,Zagovor magisterija na Oddelku za fiziko,"v četrtek, 12. septembra 2013 ob 13.30 uri v Kuščerjevem seminarju na Jadranski 19.",33804
Zagovor magisterija,"Boštjan Mavrič, Anomalni transport toplote v eni dimenziji",9. 9. 2013,Zagovor magisterija na Oddelku za fiziko,"v sredo, 11. septembra 2013 ob 14.30 uri v Kuščerjevem seminarju na Jadranski 19.",33779
Zagovor magisterija,"Maruša Vitek, Spremembe oblik fosfolipidnih mehurčkov zaradi vgrajevanja lipopolisaharidov",9. 9. 2013,Zagovor magisterija na Oddelku za fiziko,"v četrtek, 12. septembra 2013 ob 12. uri v Kuščerjevem seminarju na Jadranski 19.",33795
Zagovor magisterija,"Urška Gradišar, Analiza obsevanih živil s termoluminiscenco",3. 9. 2013,Zagovor magisterija na Oddelku za fiziko,"v četrtek, 5. septembra 2013 ob 10. uri v Kuščerjevem seminarju na Jadranski 19.",33778
Zagovor magisterija,"Miha Čančula, Modeliranje širjenja svetlobe vzdolž ograjenih tekoče kristalnih defektnih linij",27. 8. 2013,Zagovor magisterija na Oddelku za fiziko,"v torek, 3. septembra 2013 ob 12. uri v predavalnici F-7 na Jadranski 19.",34449
Zagovor magisterija,"Maja Poklinek, Analyzing patterns in experts’ approaches to solving experimental problems",23. 8. 2013,Zagovor magisterija na Oddelku za fiziko,"v petek, 30. avgusta 2013 ob 8.30 uri v Kuščerjevem seminarju na Jadranski 19.",33777
Zagovor magisterija,"Matej Krajnc, Mehanski model enoslojnega epitelijskega tkiva",21. 8. 2013,Zagovor magisterija na Oddelku za fiziko,"v sredo, 28. avgusta 2013 ob 10. uri v Kuščerjevem seminarju na Jadranski 19.",34446
Zagovor magisterija,"Boštjan Drolc, Vzpostavitev neodvisnega preverjanja kakovosti GAMA kamer v Sloveniji",20. 5. 2013,Zagovor magisterija na Oddelku za fiziko,"v petek, 24. maja 2013, ob 13. uri v Kuščerjevem seminarju (414/4) na Jadranski 19.",27766
Zagovor magisterija,"Anton Zgonc, Uporaba radarjev s pulzno kompresijo v meteorologiji",2. 2. 2011,Zagovor magisterija na Oddelku za fiziko,"v petek, 4. februarja 2011 ob 13.30 v predavalnici F-2 na Jadranski 19 ",26899
Zagovor magisterija,"Maja Jug, Odboj svetlobe na valoviti površini",30. 11. 2010,Zagovor magisterija na Oddelku za fiziko,"v četrtek, 9.decembra 2010 ob 14.30 v Kuščerjevem seminarju na Jadranski 19",25557
Zagovor magisterija,"Matjaž Ferjančič, Odziv blažilnikov sunkov pri različnih robnih pogojih modela med potresno obremenitvijo",3. 11. 2010,Zagovor magisterija na Oddelku za fiziko,"v torek, 9. novembra 2010 ob 11. uri v sejni sobi reaktorskega centra Instituta &quot;Jožef Stefan&quot;",25465
Zagovor magisterija,"Robert Hauko, Homopolarna indukcija in njen relativistični koncept",19. 4. 2010,Zagovor magisterija na Oddelku za fiziko,"v petek, 23. april 2010 ob 11. uri v Metodiki (206/II) na Jadranski 19",25471
Zagovor magisterija,"Jernej Slanovec, Magnetna frustracija v ortorombski T-fazi kompleksne kovinske zlitine Al3(Mn, Pd, Fe)",5. 3. 2010,Zagovor magisterija na Oddelku za fiziko,"v petek, 12. marca 2010 ob 10.30 uri v Kuščerjevem seminarju (414/4) na Jadranski 19",24966
Zagovor magisterija,"Vitomir Babič, Dvolomnost in komplementarne barve",11. 12. 2009,Zagovor magisterija na Oddelku za fiziko,"v ponedeljek, 21. decembra 2009 ob 8.30 v Metodiki (206) na Jadranski 19",24754
Zagovor magisterija,"Mojca Krmelj, Obravnava uklona valovanja pri pouku fizike",13. 10. 2009,Zagovor magisterija na Oddelku za fiziko,"v petek, 16. oktobra 2009 ob 10.30 v Kuščerjevem seminarju na Jadranski 19",24582
Zagovor magisterija,"Jože Pernar, Okoljske vsebine pri pouku fizike v srednji šoli",18. 9. 2009,Zagovor magisterija na Oddelku za fiziko,"v petek, 25.09.2009 ob 10. uri v Kuščerjevem seminarju (4/414) na Jadranski 19",24538
Zagovor magisterija,"Mojca Dolinar, Prostorska interpolacija konvektivnih padavin z uporabo radarskih in prizemnih meritev",24. 6. 2008,Zagovor magisterija na Oddelku za fiziko,"v petek, 27. 6. 2008, ob 12.30 v predavalnici F-6 (prizidek I. nadstr.) na Jadranski 19",23874
Zagovor magisterija,"Matjaž Stepišnik, Analiza aktivnosti primarnega hladila pri delovanju raziskovalnega reaktorja TRIGA MARK II",28. 3. 2008,Zagovor magisterija na Oddelku za fiziko,"v četrtek, 10. 4. 2008, ob 11h v Kuščerjevem seminarju (4/414) na Jadranski 19",23875
Zagovor magisterija,"Nada Razpet, Obravnavanje sevanja s hamiltonskim pristopom",23. 1. 2008,Zagovor magisterija na Oddelku za fiziko,"v četrtek, 7. 2. 2008, ob 9.30 v Kuščerjevem seminarju (414/4) na Jadranski 19",23876
Zagovor magisterija,"Saša Trstenjak, Hassejevo načelo",17. 8. 2022,Zagovor magisterija na Oddelku za matematiko,"Magistrski izpit: četrtek, 25. 8. 2022, ob 12.30 v predavalnici 2.03, Jadranska 21, 2. nadstropje.  ",36022
Zagovor magisterija,"Samo Metličar, Problem zapiranja centrov",11. 8. 2022,Zagovor magisterija na Oddelku za matematiko,"V četrtek, 18. 8. 2022, ob 11.00 v predavalnici 3.05, Jadranska 21, 3. nadstropje.",36010
Zagovor magisterija,"Miha Štravs, Avtomatska gradnja korpusa in ekstrakcija relacij v slovenščini",27. 6. 2022,Zagovor magisterija na Oddelku za matematiko,"V ponedeljek, 11. 7. 2022 ob 15.00 v predavalnici 3.05, Jadranska 21, 3. nadstropje.",35934
Zagovor magisterija,"Blaž Dobravec, Upravljanje distribucijskega omrežja z globokim spodbujevanim učenjem",20. 6. 2022,Zagovor magisterija na Oddelku za matematiko,"Sreda, 29. 6. 2022, ob 12.00 v predavalnici 2.02, Jadranska 21, 2. nadstropje.",35919
Zagovor magisterija,"Marina Sirk, Diskretni HJM model za vrednotenje obrestnih opcij",20. 6. 2022,Zagovor magisterija na Oddelku za matematiko,"Sreda, 29. 6. 2022, ob 12.00 v predavalnici 3.05, Jadranska 21, 3. nadstropje.",35918
