sth,title,posted,d_type,timeplace,id
Zagovor zaključne naloge,"Tim Kelhar, Študija zaviralcev amiloidnih bolezni z vibracijsko spektroskopijo",4. 9. 2020,Zagovor diplome na Oddelku za fiziko,"V ponedeljek, 14. septembra, ob 9.00 uri, v predavalnici F1, na Jadranski 19.",31673
Zagovor zaključne naloge Aleks Jakopič,Kontrola dimenzij palic s pomočjo računalniškega vida,11. 12. 2019,Zagovor diplome na Oddelku za fiziko,"v ponedeljek, 16. decembra 2019 ob 13. uri v Kuščerjevem seminarju (4/414), na Jadranski 19.",34001
Zagovor zaključne naloge,"Alen Kahteran, Izdelava in umeritev precizijske tehtnice",14. 11. 2019,Zagovor diplome na Oddelku za fiziko,"v ponedeljek, 18. novembra 2019 ob 12.15 uri v Kuščerjevem seminarju (4. nadstr./414), na Jadranski 19.",34084
Zagovor zaključne naloge Jure Pollak,Testiranje senzorjev za merjenje zasuka,23. 9. 2019,Zagovor diplome na Oddelku za fiziko,"v četrtek, 26. septembra 2019 ob 14.30. uri v predavalnici F-7, na Jadranski 19.",33946
Zagovor zaključne naloge,"Kaja Štojs, Konstrukcija enostavne Kibblove tehtnice za definicijski kilogram",19. 9. 2019,Zagovor diplome na Oddelku za fiziko,"v petek, 20. september 2019 ob 10. uri v Kuščerjevem seminarju, na Jadranski 19.",33940
Zagovor zaključne naloge,"Trina Resnik, Višinomer na težno nihalo",12. 9. 2019,Zagovor diplome na Oddelku za fiziko,"v petek, 13. september 2019 ob 15. uri v Kuščerjevem seminarju, na Jadranski 19.",33931
Zagovor zaključne naloge,"Aleks Prša, Napetostne pore pri celicah v hipotonični raztopini,",11. 9. 2019,Zagovor diplome na Oddelku za fiziko,"v ponedeljek, 16. september 2019 ob 11. uri v Kuščerjevem seminarju, na Jadranski 19.",31669
Zagovor zaključne naloge,"Matej Vereš, Izhodni del protonskega žarka z minimalnim kotnim sipanjem",11. 9. 2019,Zagovor diplome na Oddelku za fiziko,"v ponedeljek, 16. september 2019 ob 9. uri v Kuščerjevem seminarju, na Jadranski 19.",33909
Zagovor zaključne naloge,"Manica Perko, Samourejanje inhibitorja korozije na površini bakra",20. 8. 2019,Zagovor diplome na Oddelku za fiziko,"v petek, 23. avgusta 2019 ob 10.15 uri v Kuščerjevem seminarju, na Jadranski 19.",33823
Zagovor zaključne naloge,"Luka Žgur, Testiranje kakovosti mehanskih stikal",1. 7. 2019,Zagovor diplome na Oddelku za fiziko,"v sredo, 3. julija 2019 ob 10.45 uri v Kuščerjevem seminarju, na Jadranski 19",33763
Zagovor zaključne naloge,"Blaž Milenković, Umeritev in optimizacija nastavitev sistema ABC (Active Breathing Coordinator™) za nadzor dihalne faze med radioterapijo",8. 4. 2019,Zagovor diplome na Oddelku za fiziko,"v četrtek, 11. aprila 2019 ob 15.00 uri v Kuščerjevem seminarju, na Jadranski 19.",33410
Zagovor zaključne naloge,"Jan Kotnik Klovar, Analiza gibanja pozitivnih ionov v plazmi pred negativno ploščato elektrodo, ki oklepa majhen kot s homogenim magnetnim poljem z uporabo simulacij delec v celici",29. 10. 2018,Zagovor diplome na Oddelku za fiziko,"v torek, 30. oktobra 2018 ob 10. 15 v Kuščerjevem seminarju, na Jadranski 19.",33016
Zagovor zaključne naloge,"Davor Grabnar, Analiza lokalnih piezoelektričnih in feroelektričnih lastnosti tankih plasti (K0.5 Na0.5)0.99Sr 0.01 NbO3",21. 9. 2018,Zagovor diplome na Oddelku za fiziko,"v torek, 25. septembra 2018 ob 10. uri v predavalnici F-7 na Jadranski 19.",32905
Zagovor zaključne naloge,"Tilen Kočevar, Merjenje lomnega količnika bioloških tkiv z Abbejevim refraktometrom",17. 9. 2018,Zagovor diplome na Oddelku za fiziko,"v četrtek, 20. septembra 2018 ob 10. uri v predavalnici F-7 na Jadranski 19.",32894
Zagovor zaključne naloge,"Tilen Mramor, Nelinearni odziv elektromehanskega sistema",12. 9. 2018,Zagovor diplome na Oddelku za fiziko,"v petek, 14. septembra 2018 ob 10.15 v Kuščerjevem seminarju na Jadranski 19.",31592
Zagovor zaključne naloge,"Špela Novak, Študij magnetizma spinskih verig v spojini β-TeVO4 z jedrsko magnetno resonanco",3. 8. 2018,Zagovor diplome na Oddelku za fiziko,"v sredo, 8. avgusta 2018 ob 10.uri v Kuščerjevem seminarju na Jadranski 19.",32774
Zagovor zaključne naloge,"Tina Sever, Vpliv staranja na površinske lastnosti lasersko teksturiranih in kemijsko modificiranih površin",18. 6. 2018,Zagovor diplome na Oddelku za fiziko,"v torek, 18. junija 2018 ob 10.uri v Kuščerjevem seminarju na Jadranski 19.",31242
Zagovor zaključne naloge,"Domen Kosmač, Omejena difuzija v poroznih snoveh",24. 10. 2017,Zagovor diplome na Oddelku za fiziko,"v petek, 27.oktobra 2017 ob 10. uri v Kuščerjevem seminarju na Jadranski 19.",32070
Zagovor zaključne naloge,"Lara Anubis, Napovedna moč radiomske analize PET/CT 18F-FDG pacientov z lokalno napredovanim pljučnim rakom",18. 9. 2017,Zagovor diplome na Oddelku za fiziko,"v petek, 22. septembra 2017 ob 9.30 uri v predavalnici P.04 na Jadranski 21",31987
Zagovor zaključne naloge,"Klara Poiškruh, Analiza radioaktivnosti vodnih vzorcev iz programa obratovalnega monitoringa Nuklearne elektrarne Krško",18. 9. 2017,Zagovor diplome na Oddelku za fiziko,"v torek, 19. septembra 2017 ob 13. uri v predavalnici P.04 na Jadranski 21.",31986
Zagovor zaključne naloge,"Maj Vilić, Vpliv velikosti merjenca na rezultat meritve magnetnetnega momenta z gradiometrom",11. 9. 2017,Zagovor diplome na Oddelku za fiziko,"v petek, 15. septembra 2017 ob 12. uri v predavalnici 3.04 na Jadranski 21.",31932
Zagovor zaključne naloge,"Boštjan Kavaš, Tunelska sonda v nizko temperaturni plazmi",10. 9. 2017,Zagovor diplome na Oddelku za fiziko,"v petek, 15. septembra 2017 ob 10. uri v predavalnici 3.04 na Jadranski 21.",31238
Zagovor zaključne naloge,"Ajda Tuševski, Izdelava in karakterizacija balističnega kronografa",10. 9. 2017,Zagovor diplome na Oddelku za fiziko,"v četrtek, 14. septembra 2017 ob 9.30 uri v predavalnici P.05 na Jadranski 21.",31955
Zagovor zaključne naloge,"Tomaž Kavaš, Fotorefraktivnost v nedopiranem aluminijevem nitridu",1. 9. 2017,Zagovor diplome na Oddelku za fiziko,"v četrtek, 7. septembra 2017 ob 11. 15 uri v predavalnici P.05 na Jadranski 21.",31912
Zagovor zaključne naloge,"Aleš Traven, Vpliv izbranih parametrov na določanje fotokatalitske aktivnosti z reaktorsko metodo (optimizacija reaktorske metode za določevanje fotokatalitske aktivnosti)",1. 9. 2017,Zagovor diplome na Oddelku za fiziko,"v četrtek, 7. septembra 2017 ob 9. v predavalnici P.05 na Jadranski 21. ",31220
Zagovor zaključne naloge,"Mark Berčan, Nadgradnja vrstičnega tunelskega mikroskopa s SQUID magnetometrom",23. 8. 2017,Zagovor diplome na Oddelku za fiziko,"v torek, 29. avgusta 2017 ob 9.30 uri v Kuščerjevem seminarju na Jadranski 19.",31882
Zagovor zaključne naloge,"Anej Valič, Diagnostika ognjene palice v šibko magnetiziranem razelektritvenem stolpcu plazme z Langmuirjevo sondo",25. 7. 2017,Zagovor diplome na Oddelku za fiziko,"v četrtek, 27. julija 2017 ob 10.uri v predavalnici F-7 na Jadranski 19.",31849
Zaključna naloga,"Rok Nosan, Meritve električno induciranih deformacij s fotonskim senzorjem",29. 5. 2017,Zagovor diplome na Oddelku za fiziko,"v sredo, 31. maja 2017 ob 9.15 uri v predavalnici F-7 na Jadranski 19.",31693
Zaključna naloga,"David Kocjan, Izdelava in uporaba merilnega sistema za proučevanje karakteristik toplotnih cevi",18. 10. 2016,Zagovor diplome na Oddelku za fiziko,"v sredo, 19. oktobra 2016 ob 11.30 uri v Kuščerjevem seminarju (4/414) na Jadranski 19.",30838
Zagovor diplome,"Uroš Stele, Analiza mehanizmov loma TiAIN – TRDE PVD prevleke z metodo indentacije",29. 9. 2016,Zagovor diplome na Oddelku za fiziko,"v petek, 30. septembra 2016 ob 11. uri v predavalnici F-7 (II. nadrstr.) na Jadranski 19.",30762
Zagovor diplome,"Andrej Bizjak, Odvisnost adhezije nanostrukturnih trdih prevlek od pogojev nanašanja",29. 9. 2016,Zagovor diplome na Oddelku za fiziko,"v petek, 30. septembra 2016 ob 9.30. uri v predavalnici F-7 (II. nadrstr.) na Jadranski 19.",30761
Zagovor diplome,"Gašper Renko, Izračun hitrosti doze nad bazenom za izrabljeno gorivo Nuklearne elektrarne Krško",28. 9. 2016,Zagovor diplome na Oddelku za fiziko,"v petek, 30. septembra 2016 ob 13. uri v Kuščerjevem seminarju na Jadranski 19.",30757
Zagovor diplome,"Ana Car, Vpliv stranski robnih pogojev na naraščanje napak napovedi v regionalnih prognostičnih modelih ozračja",24. 9. 2016,Zagovor diplome na Oddelku za fiziko,"v četrtek, 29. septembra 2016 ob 14.30 uri v Kuščerjevem seminarju na Jadranski 19.",30744
Zagovor diplome,"Primož Ribarič, Prvi poizkus določitve jakosti padavin iz radarskih meritev v dvojni polarizaciji v Sloveniji",24. 9. 2016,Zagovor diplome na Oddelku za fiziko,"v četrtek, 29. septembra 2016 ob 13. uri v Kuščerjevem seminarju na Jadranski 19.",30743
Zagovor diplome,"Janez Podhostnik, Simulacija meritve elastičnega sipanja elektronov in elektroprodukcije pionov z magnetnimi spektrometri",23. 9. 2016,Zagovor diplome na Oddelku za fiziko,"v torek, 27. septembra 2016 ob 11.30. uri v Kuščerjevem seminarju na Jadranski 19.",30732
Zagovor diplome,"Blaž Šter, Sinoptično-statistična analiza napak napovedi padavin prognostičnega modela ALADIN-SI v izbranih vremenskih situacijah",22. 9. 2016,Zagovor diplome na Oddelku za fiziko,"v sredo, 28. septembra 2016 ob 13. uri v Kuščerjevem seminarju na Jadranski 19.",30717
Zagovor diplome,"Klemen Kenda, Uporaba metod strojnega učenja pri analizi podatkov, zajetih z detektorjem ATLAS",22. 9. 2016,Zagovor diplome na Oddelku za fiziko,"v ponedeljek, 26. septembra 2016 ob 9.30. uri v Kuščerjevem seminarju na Jadranski 19.",30718
Zagovor zaključne naloge,"Kristjan Žehelj, Umerjanje rentgena za izpolnjevanje dozimetričnih standardov",19. 9. 2016,Zagovor diplome na Oddelku za fiziko,"v petek, 23. septembra 2016 ob 13. uri v predavalnici F-7 (II. nadrstr.) na Jadranski 19.",30693
Zagovor zaključne naloge,"Žan Jerman, Dinamika taljenja snega slikana z magnetno resonanco",19. 9. 2016,Zagovor diplome na Oddelku za fiziko,"v torek, 27. septembra 2016 ob 10. uri v predavalnici F-7 (II. nadrstr.) na Jadranski 19.",30694
Zagovor diplome,"Elizabeth Dafne DI ROCCO, Landau-Lifšiceva stohastična hidrodinamika v prisotnosti dveh nanodelcev",19. 9. 2016,Zagovor diplome na Oddelku za fiziko,"v sredo, 28. septembra 2016 ob 11. uri v Kuščerjevem seminarju na Jadranski 19.",30690
Zagovor diplome,"Miha Juras, Stohastični model hoje molekularnega motorja dineina",17. 9. 2016,Zagovor diplome na Oddelku za fiziko,"v četrtek, 29. septembra 2016 ob 10.30. uri v predavalnici F-7 na Jadranski 19.",30753
zagovor diplome,"Jošt Vrabič Koren, Pot vesoljske sonde do Marsa v približku ravninskih tirov",17. 9. 2016,Zagovor diplome na Oddelku za fiziko,"v četrtek, 22. septembra 2016 ob 9.30. uri v Kuščerjevem seminarju na Jadranski 19.",30665
Zagovor diplome,"Edvard Srdič, Analiza kavitacije in kavitacijske erozije za zastojnim telesom",15. 9. 2016,Zagovor diplome na Oddelku za fiziko,"V sredo, 28. septembra 2016 ob 9.30. uri v Kuščerjevem seminarju na Jadranski 19.",30664
Zagovor diplome,"Barbara Marčun, Določanje oddaljenosti Andromedine galaksije s kefeidnimi spremeljivkami",15. 9. 2016,Zagovor diplome na Oddelku za fiziko,"v torek, 20. septembra 2016 ob 10. uri v Kuščerjevem seminarju na Jadranski 19.",30635
Zagovor diplome,"Uroš Dolšek, Vpliv zaužitega kofeina na difuzni refleksijski spekter kože",15. 9. 2016,Zagovor diplome na Oddelku za fiziko,"v torek, 20. septembra 2016 ob 10. uri v predavalnici F-7 (II. nadrstr.) na Jadranski 19.",30680
Zagovor diplome,"Luka Ogris, Vpliv kalijevih soli na tvorbo enomolekulskih plasti lipofilnih derivatov gvanozina na vodni površini",13. 9. 2016,Zagovor diplome na Oddelku za fiziko,"v sredo, 21. septembra 2016 ob 13. uri v predavalnici F-7 (II. nadrstr.) na Jadranski 19.",30660
Zagovor diplome,"Sara Parovel, Veterne elektrarne",13. 9. 2016,Zagovor diplome na Oddelku za fiziko,"petek, 23. septembra 2016 ob 11. uri v Kuščerjevem seminarju (4/414) na Jadranski 19.",30596
Zagovor zaključne naloge,"Ivana Marinović, Optimizacija kalibracijskega postopka za merjenje temperature s termočlenom",13. 9. 2016,Zagovor diplome na Oddelku za fiziko,"v četrtek, 15. septembra 2016 ob 13.30 uri v predavalnici F-7 (II. nadrstr.) na Jadranski 19.",30658
Zagovor diplome,"Antal Zupanc, Načrtovanje in izdelava NRM sonde za merjenje temperaturne odvisnosti difuzije",12. 9. 2016,Zagovor diplome na Oddelku za fiziko,"v petek, 23. septembra 2016 ob 9.30 uri v Kuščerjevem seminarju (4/414) na Jadranski 19.",30622
Zagovor diplome,"Matej Posinković, Dvodimenzionalni simetrični in enostavno-izključujoči se procesi",12. 9. 2016,Zagovor diplome na Oddelku za fiziko,"v ponedeljek, 19.9.2016 ob 14. uri v Kuščerjevem seminrju (4/414) na Jadranski 19.",30638
Zagovor diplome,"Rok Hribar, Razvoj modelov za toplotne izgube pri stavbah z namenom napovedovanja porabe zemeljskega plina v Ljubljani",10. 9. 2016,Zagovor diplome na Oddelku za fiziko,"v četrtek, 15.9.2016 ob 10. uri v Kuščerjevem seminrju (4/414) na Jadranski 19.",30644
Zagovor zaključne naloge,"Matic Šinko, Merjenje vžigne napetosti plinskega odvodnika v odvisnosti od temperature",9. 9. 2016,Zagovor diplome na Oddelku za fiziko,"v torek, 13. septembra 2016 ob 13. uri v predavalnici F-7 na Jadranski 19.",30642
Zagor diplome,"Simon Prodan, Krajevno občutljivo zaznavanje posameznih fotonov z večanodno fotopomnoževalko z mikrokanalnimi ploščami",8. 9. 2016,Zagovor diplome na Oddelku za fiziko,"v četrtek, 15. septembra 2016 ob 12. uri v predavalnici F-7 na Jadranski 19.",30634
Zagovor diplome,"Matija Kregar, Izdelava in preizkus večžične proporcionalne komore s katodo z integrirano zakasilno linijo",8. 9. 2016,Zagovor diplome na Oddelku za fiziko,"v četrtek, 15. septembra 2016 ob 10. uri v predavalnici F-7 na Jadranski 19",30502
Zagovor diplome,"Miha Cankar, Razširitev delovanja silicijevih fotopomnoževalk v režim nakopičenih bliskov",7. 9. 2016,Zagovor diplome na Oddelku za fiziko,"v petek, 9. septembra 2016 ob 10. uri v predavalnici F-7 na Jadranski 19.",30417
Zagovor diplome,"Zdenka Serušnik, Meritev lokalnih magnetnih polj na površini titan oksinitridnih nanopasov",6. 9. 2016,Zagovor diplome na Oddelku za fiziko,"v torek, 13. septembra 2016 ob 10. uri v Kuščerjevem seminarju (4/414) na Jadranski 19.",30013
Zagovor diplome,"Jure Koprčina, Vpliv bližnjih zvezd na gibanje kometov v Oortovem oblaku",6. 9. 2016,Zagovor diplome na Oddelku za fiziko,"v ponedeljek, 12. septembra 2016 ob 14. uri v Kuščerjevem seminarju na Jadranski 19.",30381
Zagovor zaključne naloge,"Blaž Kušnik, Modeliranuje ionske optike za sistem na zunanjem žarku",31. 8. 2016,Zagovor diplome na Oddelku za fiziko,"v četrtek, 8. septembra 2016 ob 11. uri v Kuščerjevem seminarju (4/414) na Jadranski 19.",29871
Gregor Stržinar,Optimizacija algoritmov radarske detekcije toče za območje Slovenije,30. 8. 2016,Zagovor diplome na Oddelku za fiziko,"v sredo, 31. avgusta 2016 ob 11. uri v Kuščerjevem seminarju na Jadranski 19",28896
Zagovor diplome,"Ajda Valher, Primerjava modelov za računanje vodne bilance tal",29. 8. 2016,Zagovor diplome na Oddelku za fiziko,"v sredo, 31. avgusta 2016 ob 9.30 uri v Kuščerjevem seminarju na Jadranski 19.",30398
Zagovor diplome,"Meta Kokalj Ladan, Vpliv delitve celic na strukturo epitelskih tkiv",21. 8. 2016,Zagovor diplome na Oddelku za fiziko,"v ponedeljek, 29.avgusta 2016 ob 10.30 uri v Kuščerjevem seminarju (4/414) na Jadranski 19.",29309
Zagovor diplome,"Jožef Visočnik, Opis gibanja tekočin s celičnimi avtomati",18. 8. 2016,Zagovor diplome na Oddelku za fiziko,"v četrtek, 25. avgusta 2016 ob 12.30 uri v Kuščerjevem seminarju (4/414) na Jadranski 19.",29157
Zagovor diplome,"Katja Klančar, Študij zmrzovanja z dinamičnim slikanjem z magnetno resonanco",18. 8. 2016,Zagovor diplome na Oddelku za fiziko,"v četrtek, 25. avgusta 2016 ob 10.30 uri v Kuščerjevem seminarju na Jadranski 19 (4/414)",29035
Zagovor diplome,"Domen Horvat, Zasnova in izdelava škatlice za shranjevanje in umivanje zobnih aparatov",15. 7. 2016,Zagovor diplome na Oddelku za fiziko,"v četrtek, 21. julija 2016 ob 13. uri v Kuščerjevem seminarju (4/414) na Jadranski 19.",29909
Zagovor diplome,"Urška Hribšek, Dolgočasovno spremljanje korozije bakra v bentonitnem okolju",15. 7. 2016,Zagovor diplome na Oddelku za fiziko,"v četrtek, 21. julija 2016 ob 10.30 uri v Kuščerjevem seminarju (4/414) na Jadranski 19",29930
Zagovor diplome,"Matjaž Ličar, Model zaledenitve daljnovodnih vrvi",8. 7. 2016,Zagovor diplome na Oddelku za fiziko,"v petek, 15. julija 2016 ob 10.45 uri v Kuščerjevem seminarju na Jadranski 19.",29470
Zagovor diplome,"Luka Glavič, Transportne lastnosti La0,7Ca0,3MnO3 : Električna upornost v odvisnosti od temeperature in zunanjega magnetnega polja",8. 7. 2016,Zagovor diplome na Oddelku za fiziko,"v petek, 15. julija 2016 ob 10.45 uri v predavalnici F-7 na Jadranski 19.",29777
Zagovor diplomskega dela,"Mitja Centrih, Optimizacija hladilnega sistema elektrolize vode za bogatenje tritija",20. 6. 2016,Zagovor diplome na Oddelku za fiziko,"v sredo, 22. junija 2016 ob 10. uri v predavalnici F-6 na Jadranski 19",28599
Zagovor diplome,"Ivana Novak, Diferenčna dinamična mikroskopija",12. 5. 2016,Zagovor diplome na Oddelku za fiziko,"v sredo, 18. maja 2016 ob 13.15 uri v Kuščerjevem seminarju na Jadranski 19.",30377
Zagovor diplome,"Jernej Urankar, Direktna numerična simulacija turbulentnega prenosa toplote z metodo spektralnih elementrov",18. 3. 2016,Zagovor diplome na Oddelku za fiziko,"v petek, 25. marca 2016 ob 9.30 uri v Kuščerjevem seminarju na Jadranski 19",30124
Zagovor diplome,"Andrej Leban, Časovno odvisni tok skozi kvantno piko v prisotnosti napetostne sonde",1. 3. 2016,Zagovor diplome na Oddelku za fiziko,"v petek, 4. marca 2016 ob 9.30 uri v Kuščerjevem seminarju na Jadranski 19.",27838
Zagovor diplome,"Marko Franinović, Meritev debelin ultra-tankih plasti z metodo rentgenske fotoelektronske spektroskopije",1. 2. 2016,Zagovor diplome na Oddelku za fiziko,"v četrtek, 4. februarja 2016 ob 11. 00 uri v Kuščerjevem seminarju na Jadranski 19.",27950
Zagovor zaključne naloge,"Andreja Hiti, Prenos kapljic tekočega kristala v drugi tekoči kristal",14. 12. 2015,Zagovor diplome na Oddelku za fiziko,"v petek, 18. decembra 2015 ob 9.00 uri v Kuščerjevem seminarju na Jadranski 19.",29452
Zagovor diplomskega dela,"Marjan Maček, Vpliv kovinske elektrode na robna stanja dvodimenzionalnega topološkega izolatorja",14. 12. 2015,Zagovor diplome na Oddelku za fiziko,"v petek,18. decembra 2015 ob 11.00 uri v Kuščerjevem seminarju (414/4) na Jadranski 19",29413
Zagovor diplome,"Klemen Četina, Prostorsko-časovna analiza močne burje v Vipavski dolini",26. 10. 2015,Zagovor diplome na Oddelku za fiziko,"v četrtek, 29. oktober 2015 ob 12.15 uri v Kuščerjevem seminarju na Jadranski 19.",30275
Zagovor zaključne naloge,"Janez Bijec, Spremljanje korozije jekla pod zaščitnimi premazi",30. 9. 2015,Zagovor diplome na Oddelku za fiziko,"v petek, 2. oktobra 2015 ob 9.30 uri v Kuščerjevem seminarju na Jadranski 19.",30212
Zagovor zaključne naloge,"Valentin Počkaj, Vpliv nehomogeno porazdeljene aktivnosti obsevanega vzorca v reaktorju TRIGA na rezultate k0-INAA",28. 9. 2015,Zagovor diplome na Oddelku za fiziko,"v torek, 29. septembra 2015 ob 12.30 uri v predavalnici F-6 na Jadranski 19.",30203
Zagovor zaključne naloge,"Grega Hrovat, Model učinkovanja porotvornega antibiotika na lipidne mehurčke",28. 9. 2015,Zagovor diplome na Oddelku za fiziko,"v torek, 29. septembra 2015 ob 11.00 uri v predavalnici F-6 na Jadranski 19.",30170
Zagovor diplome,"Staš Jevševar, Dinamika zvezd v kopicah",26. 9. 2015,Zagovor diplome na Oddelku za fiziko,"v sredo, 30. septembra 2015 ob 9. 30 uri v predavalnici F-3 na Jadranski 19.",29367
Zagovor zaključne naloge,"Tadej Kirašič, Merjenje uhajavega toka pri elektronskih napravah",26. 9. 2015,Zagovor diplome na Oddelku za fiziko,"v ponedeljek, 28. septembra 2015 ob 14.00 uri v predavalnici F-6 na Jadranski 19.",30164
Zagovor zaključne naloge,"Tjaš Saverin, Upogibna trdnost korundne keramike pri enoosnem in dvoosnem preskusu",26. 9. 2015,Zagovor diplome na Oddelku za fiziko,"v ponedeljek, 28. septembra 2015 ob 12.30 uri v predavalnici F-6 na Jadranski 19.",30197
Zagovor zaključne naloge,"Gaber Intihar, Modifikacija površine jekla s polimernimi prevlekami, obogatenimi s silicijevimi vključki",25. 9. 2015,Zagovor diplome na Oddelku za fiziko,"v ponedeljek, 28. septembra 2015 ob 10.00 uri v predavalnici F-6 na Jadranski 19.",30195
Zagovor zaključne naloge,"Jernej Simončič, Optimizacija merilnega sistema za sočasno merjenje Seebeskovega koeficienta in elektične prevodnosti",25. 9. 2015,Zagovor diplome na Oddelku za fiziko,v ponedeljek 28. septembra 2015 ob 8.30 uri v predavalnici F-6 na Jadranski 19,30196
Zagovor zaključne naloge,"Vid Seražin, Spontana organizacija oligonukleotidov DNK z osrednjim zaporedjem d(GGAGGGGAGG)",23. 9. 2015,Zagovor diplome na Oddelku za fiziko,"v petek, 25. septembra 2015 ob 10.30 uri v predavalnici F-3 na Jadranski 19",30191
Zagovor zaključne naloge,"Peter Medle Rupnik, Feromagnetni tekoči kristal za vizualizacijo magnetnega polja",21. 9. 2015,Zagovor diplome na Oddelku za fiziko,"v četrtek, 24. septembra 2015 ob 10.30 uri v Kuščerjevem seminarju (4/414) na Jadranski 19.",29327
Zagovor zaključne naloge,"Miha Gazvoda, Občutljivost termografije pri iskanju zračnih votlin v betonskih elementih",14. 9. 2015,Zagovor diplome na Oddelku za fiziko,"v četrtek, 17. septembra 2015 ob 10.30 uri v Kuščerjevem seminarju (4/414) na Jadranski 19.",30138
Zagovor zaključne naloge,"Urška Henigman, Vpliv remanentne magnetizacije trajnih magnetov na izkoristek elektromotorja Elaphe Marine",14. 9. 2015,Zagovor diplome na Oddelku za fiziko,"v četrtek, 17. septembra 2015 ob 9.00 uri v Kuščerjevem seminarju na Jadranski 19",30139
Zagovor zaključne naloge,"Jure Bijec, Meritve temperaturne porazdelitve v hladilnikih",8. 9. 2015,Zagovor diplome na Oddelku za fiziko,"v četrtek, 24. septembra 2015 ob 9.30 uri v Kuščerjevem seminarju na Jadranski 19",30100
Zagovor zaključne naloge,"Jernej Zupančič, Načrtovanje eksperimentalne testne sekcije za lokalno merjenje prestopa toplote med tokovnim vrenjem",8. 9. 2015,Zagovor diplome na Oddelku za fiziko,"v ponedeljek, 14. septembra 2015 ob 11.00 uri v predavalnici F-6 na Jadranski 19",30038
Zagovor zaključne naloge,"Manca Gale, Spremljanje konvekcije z magnetnoresonančno metodo slikanja pomikov z označevanjem",8. 9. 2015,Zagovor diplome na Oddelku za fiziko,"v ponedeljek, 14. septembra 2015 ob 9.30 uri v predavalnici F-6 na Jadranski 19 (I. nadstr. prizidek).",30106
Zagovor zaključne naloge,"Jurij Robba, Uporaba klasifikacijskih algoritmov za indentifikacijo delcev",10. 7. 2015,Zagovor diplome na Oddelku za fiziko,"v torek, 14. julija 2015 ob 9.30 uri v Kuščerjevem seminarju na Jadranski 19",29981
Zagovor diplome,"Marko Kozinc, Laser s pasivnim preklopom dobrote za uporabo v oftalmologiji",7. 7. 2015,Zagovor diplome na Oddelku za fiziko,"v četrtek, 30. julija 2015 ob 9. uri v Kuščerjevem seminarju (4/414) na Jadranski 19.",32656
Zagovor diplome,"Maja Uljan, Vpliv kontekstva fizikalnih nalog na privlačnost za dijake in dijakinje",5. 7. 2015,Zagovor diplome na Oddelku za fiziko,"v petek, 10. julija 2015 ob 10.00 v Kuščerjevem seminarju (4/414) na Jadranski 19.",29633
Zagovor diplome,"Gašper Jerič, Meritve sevalnih poškodb v silicijevih detektorjih",3. 7. 2015,Zagovor diplome na Oddelku za fiziko,"v četrtek, 9. julija 2015 ob 11.00 uri v predavalnici F-6 na Jadranski 19",29995
Zagovor diplome,"Andreja Kastelic, Variabilne optične uklonske mrežice na osnovi polimerov in tekočih kristalov",3. 7. 2015,Zagovor diplome na Oddelku za fiziko,"v četrtek, 9. julija 2015 ob 9.30 uri v predavalnici F-6 na Jadranski 19.",29994
Zagovor diplome,"Anže Cigoj, Raziskave površinskih reakcij nevtralnih vodikovih in dušikovih atomov",27. 6. 2015,Zagovor diplome na Oddelku za fiziko,"v četrtek, 2. julija 2015 ob 10. uri v Kuščerjevem seminarju (4/414) na Jadranski 19.",29987
Zagovor diplome,"Petra Šmitek, Vpliv stukturnega nereda na superprevodne nanožičke",24. 6. 2015,Zagovor diplome na Oddelku za fiziko,"v sredo, 8. julija 2015 ob 10. uri v Kuščerjevem seminarju (4/414) na Jadranski 19.",29984
Zagovor diplome,"Urban Pompe, Analiza možnosti transmutacije najpomembnejših nuklidov jedrskega goriva v termičnih in hitrih jedrskih reaktorjih",16. 6. 2015,Zagovor diplome na Oddelku za fiziko,"v sredo, 24. junija 2015 ob 10. uri v Kuščerjevem seminarju (4/414) na Jadranski 19.",29957
Zagovor diplome,"Gregor Šmit, Umeritev študijskega pozitronskega tomografa",3. 6. 2015,Zagovor diplome na Oddelku za fiziko,"v sredo, 10. junija 2015 ob 9. uri v predavalnici F-7 (2. nadstr.) na Jadranski 19.",29914
Zagovor diplome,"Tilen Knaflič, Model Pareto optimalne fronte 4 mestnih NACA aeroprofilov in njegova uporaba",26. 5. 2015,Zagovor diplome na Oddelku za fiziko,"v četrtek, 4. junija 2015 ob 11.15 uri v Kuščerjevem seminarju (4/414) na Jadranski 19.",29588
Zagovor diplome,"Ana Jerala, Analiza stabilnosti letaliških barometrov",25. 5. 2015,Zagovor diplome na Oddelku za fiziko,"v sredo, 3. junija 2015 ob 12.15 uri v predavalnici F-7 na Jadranski 19",29883
Zagovor diplome,"Peter Opara, Medzvezdna pordečitev iz fotometričnih in spektroskopskih pregledov neba APASS in RAVE",8. 4. 2015,Zagovor diplome na Oddelku za fiziko,"v petek, 17. aprila 2015 ob 9. uri v Kuščerjevem seminarju (4/414) na Jadranski 19.",29765
Zagovor diplome,"Dorina Sever, Lokalna okolica mangana v mezoporoznih silikatih",23. 3. 2015,Zagovor diplome na Oddelku za fiziko,"v petek, 27. marca 2015 ob 10.30 uri v Kuščerjevem seminarju (4/414) na Jadranski 19.",29715
